{
  "name": "example-callback",
  "description": "Reference plugin: a TrainerCallback that logs a marker each step.",
  "source": "https://github.com/thad0ctor/axolotl-example-plugin",
  "ref": "0000000000000000000000000000000000000000",
  "subdir": null,
  "cls": ["axolotl_example_plugin.ExampleCallbackPlugin"],
  "capabilities": ["callbacks"],
  "install_mode": "auto",
  "min_axolotl_version": "0.18.0",
  "maintainer": "thad0ctor",
  "license": "Apache-2.0",
  "checks": [
    {
      "name": "plugin-imports-and-subclasses-baseplugin",
      "run": "python -c \"import axolotl_example_plugin as m; from axolotl.integrations.base import BasePlugin; assert issubclass(m.ExampleCallbackPlugin, BasePlugin)\"",
      "timeout_seconds": 120
    },
    {
      "name": "callback-hook-fires",
      "run": "pytest -q tests/test_callback_fires.py",
      "timeout_seconds": 300
    }
  ],
  "last_scan": null
}
