{
  "name": "example-plugin",
  "description": "Reference plugin: config args, a pre-model-load banner, and a heartbeat TrainerCallback.",
  "source": "https://github.com/thad0ctor/axolotl-example-plugin",
  "ref": "3bf76a4b29a59a2bee4b093f2c49c4e9f0d7303d",
  "subdir": null,
  "cls": ["axolotl_example_plugin.ExamplePlugin"],
  "capabilities": ["callbacks", "config_args", "model_patches"],
  "install_mode": "auto",
  "min_axolotl_version": "0.18.0",
  "maintainer": "thad0ctor",
  "license": "Apache-2.0",
  "checks": [
    {
      "name": "plugin-instantiates-and-declares-its-args",
      "run": "python -c \"from axolotl_example_plugin import ExamplePlugin; p = ExamplePlugin(); assert p.get_input_args() == 'axolotl_example_plugin.args.ExamplePluginArgs'\"",
      "timeout_seconds": 120
    },
    {
      "name": "heartbeat-callback-is-a-trainercallback",
      "run": "python -c \"from axolotl_example_plugin.callback import ExampleHeartbeatCallback; from transformers import TrainerCallback; assert issubclass(ExampleHeartbeatCallback, TrainerCallback)\"",
      "timeout_seconds": 120
    }
  ],
  "last_scan": null
}
